"review.tm","Unnamed..0","drugName","condition","review","rating","date","usefulCount","score","positive","negative"
"started bc severe headaches nausea dizziness periods never heavy bleeding clotting get dizzy close fainting feet much doctors simply said hormones changing prescribed ocella havent noticed weight gain anything regulated pain dizziness periods however months ive nauseous severe headaches stomach pain coming something couldnt say pill overall worked great definitely aleviated pain menstration",6388,"Ocella","Birth Control","""I started BC because I had severe headaches, nausea, and dizziness when on my periods. I never had heavy bleeding or clotting... but I would get so dizzy I would be close to fainting if I was on my feet too much. The doctors simply said it could be my hormones changing and prescribed me ocella. I haven&#039;t noticed any weight gain or  anything. It regulated my pain and dizziness during my periods. However, after 4 months I&#039;ve been very nauseous and have had severe headaches and stomach pain. I could be coming down with something so I couldn&#039;t say it&#039;s 100% from the pill. Overall it&#039;s worked great for me and definitely aleviated my pain during menstration.""",8,"January 15, 2016",1,-6,3,9
"started beyaz recommended new pa im seeing said help pms symptoms described ive nearly completed first pack feeling completely control depressed even suicidal irritable angry feel way even worst pms times started period week month dont know continue using pill just dawned beyaz reading pamphlet now postings think beyaz may ive overwhelming symptoms",6764,"Beyaz","Birth Control","""I started BeYaz because it was recommended by a new PA I&#039;m seeing.  SHe said it would help with the PMS symptoms I described.  I&#039;ve nearly completed the first pack and I am feeling completely out of control, depressed, even suicidal, and irritable and SO angry.  I DID NOT feel this way before, even at my worst PMS times.  I started my period about a week before I should have this month.  I don&#039;t know if I should continue using this pill or not.  It just dawned on me that it could be the BeYaz, and after reading the pamphlet and now these postings, I think the BeYaz may be why I&#039;ve been having these overwhelming symptoms.""",2,"June 12, 2012",10,-7,1,8
"started beyaz years ago stopped year didnt need thought wasnt type serious relationship stopped taking proceeded end something serious decided get back months ago truly love pill go round take directed everyday hour ive missed one dosage just doubled next day started back routine directed periods werent regular first started continuing sticking taking directed became regular heavy sometimes clots can handle really recommend pill take like youre supposed also weight gain",6732,"Beyaz","Birth Control","""I started Beyaz 2 years ago, then stopped it for about a year because I didn&#039;t need it (so I thought). I wasn&#039;t in any type of serious relationship when I stopped taking it then proceeded to end up in something serious. I decided to get back on it (3-4 months ago) and I truly love this pill. This go round I take it as directed, everyday on the same hour. I&#039;ve missed one dosage and just doubled up the next day and started back my routine as directed. My periods weren&#039;t regular when I first started it, but continuing it and sticking with it and taking it as directed... they became regular. Not so heavy (sometimes have clots but I can handle that). I really recommend this pill. But take it like you&#039;re supposed to!  Also: no weight gain for me!""",9,"November 10, 2016",8,3,4,1
"started cramping next day taking pills cramps every day last weeks lower back pains angry episodes just symptoms anger definitely major factor though getting week",131417,"Generess Fe","Birth Control","""Started cramping the very next day after taking the pills. And have had the cramps every day for the last 3 weeks. Lower back pains and angry episodes are just some of the symptoms. The anger has definitely been a major factor though. I am getting off of them in a week.""",1,"December 24, 2013",10,-5,0,5
"started generess fe weeks ago first extremely wary reviews unstoppable weight gain terrible mood swings breakthrough bleeding acne worsening headaches edge first days face broke worst since middle school upset spent much time money good skin week half two face completely cleared since actually less small acne wasnt bc side effects experienced far knock wood bit touchy certain days even random days good bit munchies cravings otherwise weight gain crazy moods",131429,"Generess Fe","Birth Control","""I started Generess Fe 3 weeks ago, and at first I was extremely wary; I had reviews about unstoppable weight gain, terrible mood swings, breakthrough bleeding, acne worsening, and headaches, so I was on the edge. The first 3 days my face broke out the worst it had since middle school, and I was so upset about it because I had spent so much time and money to good skin, but after about a week and a half or two, my face has completely cleared up, since then I actually have less small acne then when I wasn&#039;t on BC. The only side effects I have experienced so far (knock on wood) is I am a bit more touchy on certain days or even random days, and I have a good bit more of the munchies or cravings, but otherwise no weight gain or crazy moods. :)""",8,"November 6, 2013",6,-5,6,11
"started gianvi switching yaz another pill nothing used intense day period extreme cramps migraines large pimples crazy mood swings apparent reason gianvi changed still get cramps mood swings muted much smaller breakouts migraines gone get light bleeding period lasts days however miss period bleeding part often still get symptoms time personally love gianvi feel much freer things like drive know wont suddenly doubled pain behind wheel",111849,"Gianvi","Birth Control","""I started Gianvi after switching from Yaz to another pill that did nothing for me. I used to have an intense 7 day period, extreme cramps, migraines, large pimples, and crazy mood swings for no apparent reason. Gianvi has changed all that. I do still get cramps and mood swings, but both are very muted. I have much smaller breakouts and the migraines are gone. I get a very light bleeding during my period, which only lasts 2-3 days. HOWEVER, I miss my period (the bleeding part) often. I still get the other symptoms at that time. Personally, I love Gianvi. I feel much freer to do things like drive because I know I won&#039;t be suddenly doubled over in pain behind the wheel.""",9,"March 27, 2013",3,-5,2,7
"started taking bc last year got mirena taken due bad acne weeks starting triprevifem started hypoglycemic episodes run miles continued every run started taking supplements run keep blood sugar stable helps partly annoying last months hypoglycemic episodes morning without physical activity now ive decided stop taking",124855,"Tri-Previfem","Birth Control","""I started taking this BC last year 11/2014 when I got the Mirena taken out due to bad acne. A few weeks after starting Tri-Previfem I started having hypoglycemic episodes after I run (~4miles ). Which continued after every run so I started taking supplements before and during my run to keep my blood sugar stable. Which helps partly and very annoying. But the last 2 months I had 2 hypoglycemic episodes in the morning without any physical activity. It&#039;s now 8/2014 and I&#039;ve decided to stop taking them. 

Cons: hypoglycemia, stomach bloat during period

Pros: no acne, regulated periods (precise day and round about time of day), minimal/no cramps.""",6,"August 25, 2014",4,-1,1,2
"started taking birth control almost years ago nauseous first weeks subsided seemed going great months ago missed one pill took within hours ended throwing fault lately struggling horrible anxiety years old leave college awful nausea low sex drive boyfriend sure symptoms birth control just anxiety around time period tracker says im ovulating discharge seems thick mucus like im sure normal otherwise absolutely affordable seems reliable",5310,"Cryselle","Birth Control","""I started taking this birth control almost 2 years ago. I was very nauseous for the first few weeks but it subsided and seemed to be going great! A few months ago, I missed one pill and took 2 within a few hours of each other and ended up throwing up (my own fault). Lately, I have been struggling with horrible anxiety (18 years old about to leave for college) and I have had awful nausea and low sex drive with my boyfriend. I am not sure if these are symptoms of my birth control or just anxiety. Around the time my period tracker says I&#039;m ovulating, my discharge seems to be very thick and mucus like. I&#039;m not sure this is normal. Otherwise, absolutely affordable and seems to be reliable!""",9,"January 22, 2016",2,-4,4,8
"started taking birth control months got married husband first brand ive ever tried ive noticed sideeffects even crazy prewedding time wasnt weight gain crazy mood swings slightly nauseous first days temporary ive years now problems periods light problems",131392,"Generess Fe","Birth Control","""I started taking this birth control a few months before I got married to my husband.  It&#039;s the first and only brand I&#039;ve ever tried, but I&#039;ve noticed no side-effects.  Even during that crazy pre-wedding time, there wasn&#039;t any weight gain or crazy mood swings (I was slightly nauseous the first few days, but it was very temporary).  I&#039;ve been on it 2 years now with no problems.  Periods are very light, no problems.""",10,"October 25, 2014",11,-3,1,4
"started taking gianvi month ago nothing good say read reviews thought fine never cried much life things never bother break tears starting make crazy since never emotional person putting stress boyfriends relationship fight daily basis now nothing issue slight arguments feel depressed takes everything get bed morning im never happy havent gained weight havent gotten pregnant thats positive thing",111933,"Gianvi","Birth Control","""I started taking Gianvi about a month ago and have nothing good to say about it. I read the reviews and thought I would be fine but I have never cried so much in my life. Things that never bother me break me down to tears and its starting to make me crazy since I was never an emotional person. It&#039;s putting stress on me and my boyfriends relationship because we fight on a daily basis now when before nothing was an issue to slight arguments. I feel depressed and it takes everything out of me to get out of bed in the morning. I&#039;m never happy but haven&#039;t gained weight and haven&#039;t gotten pregnant but that&#039;s the only positive thing. """,1,"June 4, 2011",2,-1,5,6
"started taking last month initially taking microgestin making extremely moody gave acne switched sronyx skin clear hardly side effects second month pill just seems like side effects really go away months love pill doubt switching tried many including mirena good one",43192,"Sronyx","Birth Control","""I started taking this last month.  Initially I was taking Microgestin but it was making me extremely moody and gave me acne.  Then I switched to Sronyx and my skin is clear again and I hardly have any side effects.  This is my second month on the pill and it just seems like the side effects really do go away after 2 or 3 months. I love this pill and I doubt I am switching. I have tried so many, including the Mirena.  This is a good one.""",9,"April 1, 2011",21,2,4,2
"started taking loseasonique weeks ago since ive started taking ive experienced many negative side effects cramping gaining lbs intense mood swings will cry reason get angry extremely easily significant increase acne will continue take medication next months see things will change medication system long enough like say pill different everyone",43635,"LoSeasonique","Birth Control","""I started taking LoSeasonique about 3 weeks ago. Since I&#039;ve started taking it I&#039;ve experienced many negative side effects such as cramping, gaining 10 lbs, intense mood swings where I will cry for no reason, get angry extremely easily, and a significant increase in acne. I will continue to take this medication for the next 3 months and see if things will change once the medication has been in my system for long enough. But like they say this pill is different for everyone.""",4,"September 24, 2010",2,-1,4,5
"started taking ocella due complications ruptured ovarian cyst im th day taking still period ive getting chest pain rapid heart beats absolutely sex drive experiencing worst migraines life will recommend pill anyone",6274,"Ocella","Birth Control","""I started taking Ocella due to complications with a ruptured ovarian cyst. I&#039;m on my 10th day of taking it and I still have my period. I&#039;ve been getting chest pain and rapid heart beats, I have absolutely no sex drive and I have been experiencing the worst migraines of my life. I will not recommend this pill to anyone.""",1,"August 9, 2017",2,0,2,2
"started taking pill everything else gave cystic acne first loved pill besides fact gave terrible mood swings sex drive tolerated part seemed like losing lbs increasing bra size happy year started going thru periods seemed like depression lasting months longest years id gained lbs months without lifestyle change nothing help lose weight finally decided stop taking month ago already lost lbs x happier sex drive back didnt get pregnant worth longterm side effects",6279,"Ocella","Birth Control","""I started taking this pill because everything else gave me cystic acne. At first, I loved this pill, besides the fact that it gave me terrible mood swings and no sex drive. I tolerated that part because it seemed like I was losing lbs and increasing bra size which I was happy about. But about a year into it I started going thru periods of what seemed like depression, lasting about 3 months at the longest. 2 years into it, I&#039;d gained about 10 lbs in 3 months (without any lifestyle change) and NOTHING I did would help me lose the weight. Finally I decided to stop taking it 1 month ago and I already lost 5 lbs, am 10x happier, and my sex drive is back. Didn&#039;t get pregnant, but not worth the long-term side effects.""",4,"April 18, 2017",2,2,7,5
"started taking pill ive relationship awhile wanted safe decided start sex ive now four months experience terrible first three months severe stomach pain led loss appetite decrease lbs mean great lost weight wasnt healthy body go also continue experience fatigue little motivation exhausted slightest amount activity also feel sad constantly cry almost every day mood swings caused strain relationship",37788,"Reclipsen","Birth Control","""I started taking this pill because I&#039;ve been in a relationship for awhile and wanted to be safe once we decided to start having sex. I&#039;ve now been on it for four months and my experience has been terrible. For the first three months I had severe stomach pain which led to a loss of appetite and a decrease of 15lbs. I mean it&#039;s great that I lost some weight but it wasn&#039;t healthy for my body to go through that. I also continue to experience fatigue. I have little motivation because I am exhausted from the slightest amount of activity. I also feel very sad constantly. I cry almost every day and my mood swings have caused strain on my relationship.""",4,"October 19, 2015",5,-6,4,10
"started taking reclipsen four months ago first everything fine periods became regular tolerable oiliness skin went however month ago started experiencing horrible mood swings already depression anxiety greatly exacerbated issue started snapping people crying suicidal thoughts went doctor mood stabilizers almost impossible find one didnt react reclipsen ruined numerous relationships time stopped taking within one day felt calmer im definitely taking will looking iud",37815,"Reclipsen","Birth Control","""So I started taking Reclipsen about four months ago. At first, everything was fine. My periods became regular and tolerable and the oiliness of my skin went down. However, about a month ago, I started experiencing horrible mood swings. I already had depression and anxiety but this greatly exacerbated the issue. I started snapping at people, crying, and having suicidal thoughts. I went to a doctor for mood stabilizers and it was almost impossible to find one that didn&#039;t react with the Reclipsen. I ruined numerous relationships during that time. I stopped taking it and within one day I felt calmer. I&#039;m definitely not taking it again and will be looking at an IUD.""",4,"April 19, 2017",6,-5,2,7
"started taking years old now almost ordinary antibiotics werent helping acne problems unpredictable periods often skipping every several months reason painful cramps period lasting whole days now clear face regular lightmedium period lasting days cramps sexually active never im sure effective actual birth controlwise sex drive much lower may end finding new brand get married later year side effect alone",6403,"Ocella","Birth Control","""I started taking this when I was 17 years old (now almost 22) and ordinary antibiotics weren&#039;t helping my acne problems. Before, I had unpredictable periods (often skipping once every several months for no reason), painful cramps, and a period lasting up to 7 whole days. Now I have a 99% clear face, a regular light-medium period lasting 4-5 days and NO cramps! I am not sexually active (never have been), so I&#039;m not sure how effective it is for me actual birth control-wise, but my sex drive is much lower. I may end up finding a new brand once I get married later this year because of this side effect alone.""",9,"April 21, 2015",7,0,3,3
"started yasmin switched ocella released issues helped cramps shortened period day helped clear skin gained weight eating healthy stayed active stopped taking months surgery got pregnant back now never moodiness helped time month migraines get recommend anyone fyi started now",6441,"Ocella","Birth Control","""I started on Yasmin, then switched to Ocella when it was released. I had no issues with it. It helped my cramps, shortened my period by 2 day, and helped clear out my skin. I gained no weight (but was eating very healthy and stayed active). I stopped taking it for 2 months to have a surgery, got pregnant, and am back on it now. I have never had any moodiness, and it has helped with my time of the month migraines I would get. I would recommend this to anyone. FYI, I started on this when I was 24 and am now 27.""",10,"May 21, 2010",6,6,7,1
"started yaz yasmin losing hair ever since suddenly switched ocella warning experienced beautiful skin day periods hair loss stop tested pcos thats negative experienced nausea headaches definitely decrease sex drive pms always terrible hasnt changed either way asked doctor hair loss told birth control unfortunately lost job insurance without birth control months time hair started grow back now back ocella hair still growing back yrs old taking ocella since came im fan",6410,"Ocella","Birth Control","""I started out on Yaz and Yasmin. I have been losing my hair ever since. Suddenly I was switched to Ocella with no warning. I experienced the most beautiful skin and 2 day periods, but the hair loss did not stop. I was tested for PCOS but that&#039;s a negative. I have not experienced nausea, headaches, and definitely no decrease in sex drive. My PMS has always been terrible and that hasn&#039;t changed either way. I asked my doctor about the hair loss and was told that it could not be the birth control. Unfortunately I lost my job and my insurance. I was without birth control for 4 months. During that time my hair started to grow back. I am now back on Ocella and my hair is still growing back. I am 30 yrs old, I have been taking Ocella since it came out. I&#039;m a fan.""",10,"March 25, 2012",6,-8,1,9
"switch caziant first month fine sudden im always angry although dont break normally acne cheeks like ive seen people think might yeast bacteria infection never",37773,"Reclipsen","Birth Control","""So I had to switch from Caziant to this and the first month was fine but all of a sudden I&#039;m always angry and although I don&#039;t break out normally I have acne all over my cheeks and like I&#039;ve seen with other people I think I might have a yeast or bacteria infection, which I have never had before.""",5,"June 21, 2014",3,-1,2,3
"switched gianvi months ago taking yaz year first everything okay weeks felt depressed tired hungry time motivate anything depressed kind person also headaches high blood pressure stomach cramps",111981,"Gianvi","Birth Control","""I switched to Gianvi about 3 months ago (after taking YAZ for a year). At first everything was okay, but after a few weeks, I felt more and more depressed, tired and hungry - all the time! I cannot motivate myself to do anything, and I am not a depressed kind of person. I also had headaches, high blood pressure and stomach cramps. """,1,"October 22, 2010",2,-4,0,4
"switched reclipsen zovia years getting outrageous hormonal acne almost months skin cleared right wasnt getting pimples period actually liked skin amazing however constantly bloated huge belly nothing amount ate drank worked stopped taking reclipsen couldnt handle bloated belly clear skin just wasnt worth im still looking perfect bc pill let search continue",37796,"Reclipsen","Birth Control","""I switched to Reclipsen from Zovia after 7 years because I was getting outrageous hormonal acne. I was on it for almost 2 months, and my skin cleared right up. I wasn&#039;t getting pimples before my period, and I actually liked my skin again, it was amazing! However, I was CONSTANTLY bloated. I had a huge belly and it had nothing to do with the amount I ate, drank, or worked out. I stopped taking Reclipsen because I couldn&#039;t handle the bloated belly; Clear skin just wasn&#039;t worth it. I&#039;m still looking for that perfect BC pill. Let the search continue....""",7,"July 24, 2015",1,5,8,3
"taken gianvi four years now started birth control reason cleared face within months didnt feel anxiety anything mood sex drive without taken gianvi tried vestura vestura affected badly terrible mood swings felt terrible days taking afterwards went back gianvi things got back normal",111817,"Gianvi","Birth Control","""I have taken Gianvi for about four years now, started it for birth control reason, it cleared my face within months, I didn&#039;t feel any anxiety or anything that has to do with my mood, my sex drive has been the same with or without. Once I was taken out of Gianvi, and tried Vestura, Vestura affected me badly! I had terrible mood swings, felt terrible for those days taking it, afterwards I went back to Gianvi and things got back to normal.""",10,"March 2, 2015",5,-3,1,4
"taken pill two years now originally put polyp polyp decreased dramatically side effects minus minor spotting mood increased dramatically right period used really bad cramps get period however practically nonexistent now",6684,"Beyaz","Birth Control","""I have taken this pill for two years now.  I was originally put on it, because of a polyp.  The polyp decreased dramatically.  I have had no side effects minus minor spotting.  My mood has increased dramatically right before and during my period.  I used to have really bad cramps when I would get my period; however, that is practically non-existent now.""",10,"September 18, 2013",11,-1,1,2
"taking bc months great last month started getting headaches quick heartbeats lose sleep gained weight right areas plus cant put headaches im tired time total loss sex drive weird think sex time made cry serious emotional outbreaks switched azurette will see",37840,"Reclipsen","Birth Control","""I have been taking this BC for about 4 months, it was great until the last month when I started getting headaches, quick heartbeats, lose of sleep. I gained weight in all the right areas so that was a plus. But I can&#039;t put up with the headaches, I&#039;m tired all the time and total loss in sex drive (which is weird because I think about sex all the time). Made me cry here and there but no serious emotional outbreaks. I switched to Azurette so we will see.""",7,"June 2, 2016",3,-4,3,7
"taking little month now satisfied yet alot spotting happening get cramps something trying get still causes take pain medication also worst acne ever whole life never badly months nothing changed will done product onto another wedding week sad say pill caused skin look like much flawless skin day honeymoon",43694,"LoSeasonique","Birth Control","""I have been taking this for a little over a month now. Not satisfied yet. I have had ALOT of spotting happening, I get cramps (of which was something I was trying to NOT get) which still causes me to take my pain medication, I also have had the worst acne I have ever had in my whole life. I have never had it this badly. If after 3 months nothing has changed. I will be done with this product and onto another. I have a wedding in a week and am sad to say this pill caused my skin to look like this. So much for flawless skin on my day and honeymoon.""",3,"September 27, 2011",2,-1,3,4
"taking loseasonique years never problems lately due new job bad taking pill time every day causing lot spotting fault noticed decrease sex drive otherwise never problem years",43620,"LoSeasonique","Birth Control","""I have been taking LoSeasonique for years. I have never had problems with it until lately. Due to my new job I have been bad at taking the pill the same time every day which is causing a lot of spotting, which is my fault. But I have noticed a decrease in sex drive. Otherwise I have never had a problem with this for 5 years.""",9,"August 5, 2014",3,-4,0,4
